Name,Date,Text,Label,Score
Sage Stringos,1/2/2023,It would be five stars but I'm disappointed that you don't receive points for having children and animals and how many action cards you get. The first game is better because of that. You should add those features.,negative,0.6875479221343994
Cheryl L,8/19/2020,Very boring game as it's pretty much the same outcome no matter which option you choose so there's nothing special about this game! I totally regret ever paying for this one as it definitely was not worth it!,negative,0.9560654163360596
Dory Zaouk,10/4/2020,Fun game with an improvement to the old classic. And an option to fast forward players' moves. I really enjoyed it.,positive,0.9858961701393127
Jared Dinaburg,12/10/2020,It's a great and fun game. I enjoy playing it with my wife. My only huge complaint is that my wife and I bout the bundle for fairytale kingdom and now it's gone and I paid money to have that board. My wife has Apple and she bought the same board bundle and has it. I have Android and it's gone. My wife tries to invite my to play fairytale kingdom and when I enter the code to play it says invalid code. Also it says I owned fairytale kingdom and I can't get it again. I'm extremely not pleased,positive,0.4679029881954193
Dre McCoy,2/26/2023,"Love it so far me and my immediate family play every lol. No problems at all. No ad problems, payment problems, free to play!! Might as well but it today!",positive,0.980046272277832
Melvin May,6/4/2023,"Haven't played yet but I have seen a YouTuber play it, It's really nice and like the board game it's just it takes several tries for me to download it so unless you can handle that like me.... Don't waste your money",positive,0.4979640543460846
Justin Dillman,3/20/2021,Very very repetitive unless you want to spend more money on add ons. Paying only gets you the base game and it's very short and no replay value,negative,0.8989624381065369
Kenny Rain,2/10/2023,Once I bought it. Noticed I can only play one map without having to also purchase each map individually. I dont recommend buying the full version,negative,0.7295659780502319
Rinn Tischler,7/24/2020,"I love it. It fun and easy, and new game play impressive make me super excited to see future world to come. Great little game to play with my nephew too. Such a great purchase.",positive,0.9918752312660217
Karen B,9/15/2020,I'm not sure why this is not cheaper with it freezing all the time. I'd give it 5 if you can fix the freezing. I've only been playing for 1 hr,negative,0.8049330115318298
Michael Mazierski,8/30/2022,This game would be fun if... Game didn't crash every 8 minutes. Restarted it again and then it crashed again 8 minutes in. Cool,positive,0.6450915336608887
Dalton McBurney,7/19/2020,Great game but can never finish a game because it allways over heats my phone ( Samsung s7) this is the only game that I've had do that so hopefully u guys can figure something out to prevent it from overheating would be great.,negative,0.6261042356491089
Blake Hovermale,8/19/2020,"I would give it a 5 star, but the game locks up every once in awhile making me have to stop the app and load again. Overall good game, would be great if that was fixed",positive,0.395204097032547
Gillian Ford,3/15/2021,"I love this game. One of my all time favourite games, perfect for all the family to get up and play. I can't wait to see when the game of life 2 comes out on the Nintendo switch.",positive,0.9900801777839661
D C,12/11/2022,"*COULD BE 5 STARS WITH ASSISTANCE* It will only let me download my game to one device, and let it have all the maps i mean, I bought the lifetime maps bundle, and can't get the maps to be purchased on my tablet.",negative,0.503494918346405
Syahid Hafizi,1/29/2021,"Decided to play because of Ohmwrecker. Now, i do love the concept of the game. I guess, somehow it does let us learn what path we decide. Good Game though. Thumbs up to the developers 👍🏻👍🏻👍🏻",positive,0.9360302686691284
Kyle Kinderman,12/10/2020,"Game disappeared from apps Not sure what happened, but after the update, the game disappeared from my apps. Have to go through the play store if I want to play it.",negative,0.6665016412734985
Kelli Carruthers,2/6/2022,"Great little game! Fun for all ages. As good as the board game, with the exception of having globally friends! Ty for this little game in such a negative time in our lives.",positive,0.9776989221572876
Gary Campbell,8/6/2020,"So far so good!! Pretty great little game, Lots of different options with the same feel as the original. Worth the download, Vams can get expensive with all the extra Add Ons",positive,0.9787383675575256
Sirchucky247,7/16/2020,Very cute was worried about lag however game ran very smoothly on LTE connection! Great time killer hoping that I can slowly unlock cosmetics for car/player with the puzzle pieces I earn! Overall great game,positive,0.9678875803947449
Jake,3/25/2021,I absolutely love the game but now it seems I'm not getting my puzzle pieces when I grow my family. All I need is three left to open up the next land and for some reason I don't receive my pieces like I'm supposed to?! I've grown my family at least 5 times and have received NOTHING.,negative,0.7640591263771057
Melissa Martin,7/16/2022,Once you purchase the game it shouldn't cost you to go to other boards. I like the game but it gets boring after playing the same board over and over and over again.,neutral,0.4541824460029602
Benjamin Yitzsroel Goldman,2/7/2021,"This game is so great and amazing But, the DLC is 4 times more expensive rather than in the pc(I check in Steam website). Altough the discount in the mobile is 73% and 54% while in the pc maximum discount 30% and 15% with the same quality services and amount products, which is technically it should be more expensive in the pc rather than in the mobile because the discount is less. In the mobile it cost $42 with the 73% discount while in the pc it's only cost $12 with the 30% discount.",positive,0.44430404901504517
Dodo Mt,12/27/2020,Works pretty well. I've played a few matches of pass and play with my little brother and we had a blast. It's not the best game in the play store but it's a solid board game with a great execution.,positive,0.9772207736968994
Stephen V,12/23/2020,Fun game but is is too short of a game Also if another player goes afk there is no timer or eject player option so you are stuck waiting or have to leave the game. I also wish there was a chat option.,negative,0.7884997129440308
Andréy P.,10/17/2022,"Enjoying this game with my family. But the problem is when I login to bubble, I cannot change the name of other player in pass & play. Please fix it.",neutral,0.4179031252861023
Patrick Silva,4/21/2023,"I cant install this app.. deleted the play store, download manager and play services cache data, uninstall updates, reset the device, used wifi or mobile data, cleared apps to have 5gb of available data Nothing works, and i cant refund it, so i cant use an app i bought",negative,0.8695243000984192
Camo Hunter,1/8/2021,"Fun but sometimes this game crash or broken. When computer(CPU) spin, this game start stuck or crash in a single player. Please Fix! I give 1 star because this game crash and cannot refund.",negative,0.9352335333824158
Mike MC,11/30/2021,"WHY IS THERE NO TIMER FOR ONLINE? Seriously. Can't finish an online multiayer game when the opponents just sit idle doing nothing for 30 minutes. Useless, YOU SHOULD KNOW BETTER THAN TO ALLOW PEOPLE NO TIME LIMITS",negative,0.9433990120887756
Dylan Yeager,4/21/2022,"Keeps freezing on ""Waiting for 'computer player name'"" Won't let me pause to save and quit either. My app is fully updated.",negative,0.7977309823036194
Katherine Churma,9/3/2020,Loving this game!! Just purchased Season Pass. Was wondering when the new worlds will be released? Please and thank you. Life was and is always my favorite board game. Love having it on an app!!,positive,0.9867303371429443
Astr0 Bear,7/9/2022,It's so fun and you can play with friends and family online or pass it around and also use smart view on a TV to stream it for everyone to see the game! Well worth it,positive,0.9752706289291382
Ghanja Lounge,10/28/2020,"My rating would be 5 stars, but there's no way to chat to other players when you're playing online. Also no emotes or taunts, that would make it a bit more interesting.",negative,0.58184814453125
Amanda Brant,11/12/2022,"Simple, but fun! Good game to pull out and knock out a round or two while chilling with a friend, playing with family, or just passing time.",positive,0.9595356583595276
Danielle Maieritsch,12/23/2022,"It's really good, and it's a very fair price! You can customize your character, get married! Lol. Not one thing a would change!",positive,0.972520649433136
Kieran Miller,11/16/2021,Played a small amount so far and in loving it. I've had some bad experiences with games based on tabletop games but this does not fall into that category. Completely recommend,positive,0.9071128964424133
hotsilverangelyue,12/25/2021,Good game to pass around with friends and family. Though slightly repetitive and online is basically abandoned.,positive,0.819807231426239
Eline,1/23/2023,"Great game, but I lost all my progress when I got a new phone. It remembered that I bought some of the bundles, but not the progress of them. I have to start over with all of them.",negative,0.665244996547699
Chrystal Christie,8/29/2021,I honestly wish this was an actual board game its so much fun. There are a few issues with it crashing every now and again but other than that its great,positive,0.9090392589569092
Alrie Alves,4/22/2022,"Bought this game just so that I can play with friends, but it has hung every single game ive tried to play against a friend. A waste of money. Disappointed.",negative,0.8873447775840759
Emily Shank,7/22/2020,"This is amazing game! I recommend getting it. The developers spend alot of time creating it and its delightful. Also, there will be new worlds aswell.",positive,0.9899783134460449
Stephen Briggs,8/24/2020,Game keeps freezing in the middle of the game as the npc's in single player can't decide what to do. Refunding the game.,negative,0.9010611176490784
Tigger Mackie,8/18/2020,Hi yes I like the game but for about 2 weeks now when me and my brother try and play it together we have a very hard time to get on and even play a full game without one of us getting kicked out plzzzz fix this thanks,negative,0.6512969732284546
hazel Bowen,5/12/2022,It is a great game and stays true to the original board game. Only thing is it is no longer letting me play online anymore. I can't figure out why either. It won't let me put in my game name either.,negative,0.49388155341148376
Angie Parsley,1/8/2021,Decent basic life game. Now if this was free I would be willing to fork out $6+ on a bundle but since I already payed for the game I won't be buying more into it.,neutral,0.37721920013427734
Lilly Persicke,8/18/2021,Awesome game way more fun playing on my phone than playing with a board. Works great. Doesnt take a long time to load without high speed data.,positive,0.9783285856246948
Firman Hidayat,3/29/2023,"i played online several times, now i cant play it anymore bcz it said no connection! an internet connection is required to play online. My internet work well :( edit : Thanks alot it work well again after i reinstalled it",negative,0.751329779624939
Brandon Buckley,10/10/2020,"So I came back to rate the game again. I got a new phone because it was time, so I install only to find all my progress is gone.. haha. Good luck with that style..",positive,0.7282450199127197
Deb L,6/25/2021,"Works great, until it doesn't. The game is fun, but it freezes when I receive notifications via any other app.",negative,0.5551227331161499
Caiden Gaming,3/8/2023,"Game is really great and I saw your reply. I can't get the game anymore, (not enough money) although it would be great if it went on a sale or something. I'm so close to getting a lot of play points",positive,0.9089094400405884
Caesar Porman,7/11/2021,great game for 15 min of fun. other platform cost 10x more. so if just want to have a quick fun buy a 1 or 2 5$ maps. should be more than enough to entertain u and fam,positive,0.9584894776344299
Matthew Munson,10/2/2020,"This is game is very addicting. My friend and I play everyday for hours on end. However, we have been anticipating new worlds and so far none has come out. When will new worlds arrive?",positive,0.8438832759857178
Traci Kintner,3/5/2023,"BORING! I can't believe I paid $1.99 after using a $2 credit. I was questioning my purchase after 10 min. After 30 min., I was done",negative,0.9523801207542419
Christi Davis,5/14/2021,Love this game on any platform. I wish the pass to play game was a little more involved and not as short. Overall my daughters and I enjoy playing.,positive,0.981174111366272
ItsOnePixel,1/16/2021,"Perfect game! Saw Jdlly, Slogo and Crainer play it, and I instantly wanted to buy it. The game is a great experience, alone or with friends and family.",positive,0.986499547958374
Marianne V,11/9/2021,"Had to change from android to iPhone for medical video sessions only available on FaceTime. Google can I have refund on game pass and all games purchased under android phone, and now I’m medical required to have iPhone for FaceTime to up keep my many Dr appts. Marianne Vinas, a customer for years!",neutral,0.5321986675262451
Sarah Rabel,7/27/2021,It is one of my favorite old board games. Was hoping the collectables would unlock more. It wasn't what i expected.,positive,0.6828050017356873
Shayla Namauu,9/2/2021,Had to factory reset my phone. I lost everything I had gotten from collecting the puzzle pieces. No way to get them back that I'm aware of. :(,negative,0.9117715954780579
Traveller,1/17/2023,"Was hoping to take advantage of the 50% off the VIP pass, that was valid for 10 more days - but it's since dropped off and gone back to fill price. Oh well....",negative,0.6078224182128906
Ben Campbell,12/31/2020,"Play with friends' option simply doesn't work. Repeated 'Invalid Code' errors. Considering that was the sole reason for purchasing, this can only get 1 star.",negative,0.9219740629196167
Lamar Taylor,1/14/2021,"Computer cheats too much to enjoy a game. Computer always gets the better job, higher rolls, and always has more money. Had to delete",negative,0.8244609832763672
Shannon Huskinson,5/11/2021,"If I could give this 0 stars I would. This game is absolutely rubbish. All it does is crash, stops working and just doesn't even work correctly. Just wish I could get my money back on it its that awful. Do not bother wasting any money on this.",negative,0.9617444276809692
Fredrick Snett,7/21/2020,The game of life is one of my favorites as a kid. I haven't played it since I was about 7. No one plays board games in real life anymore. I can finally play it again since this game is all around the world(online game)! Thank you!,positive,0.9586215019226074
Loree Wiedeman,4/30/2023,"Fun game, but I paid for sweet room, and didn't get any of the items included with the bundle... 5 dollars for NOTHING!!! Very disappointed...",negative,0.929387092590332
The Majik Manifesto,11/17/2021,"I really like this game! Cute, fun, interactive and entertaining. Thank you to the developers for bringing one of my childhood favorites to LIFE! (no pun intended) 😁",positive,0.9912447333335876
Annika Chambers,1/17/2021,"It's a fun game, but you'd think for paying $4 it wouldn't glitch every 5 minutes and have to restart the game.",positive,0.4850287437438965
kandi kane,2/13/2021,It freezes up constantly and then kicks you out the game. Ive only had for a hour and i have been kicked off twice. Money wasted smh.,negative,0.9490458965301514
Amanda Hicks,5/20/2021,My 8 year old daughter loves playing this game together but I find it a little boring after a could of games. I wish there different boards not just the one...,negative,0.4724425673484802
Cloud Leach,3/5/2021,"Amazing, I play it everyday with my wife. I bought the full version and would do it again for how much fun we've really had, it's ridiculous.",positive,0.9805079102516174
Ryan Peck,10/10/2020,"Single player game is not very interesting, is it's mostly just chance. The look is wonderful, but not fun enough for me to want to play again.",negative,0.9095025062561035
DatDuelist,4/19/2021,Love the game! Sad thing that the expansions are just overly priced cosmetics. I have to say that the fantasy set rocks though. Love it,positive,0.9043494462966919
Kelly Schachter,7/22/2022,The game is super fun! I would definitely give it 5 stars if the action cards were also themed for each of the alternate boards.,positive,0.9866581559181213
Casper Mendez,10/11/2020,Its just the way i expected to be. This is exactly how game of life used to be just with a few fun little upgrades. I really enjoy this game and can only recommend it,positive,0.9793419241905212
KiroPezza,3/19/2022,"Great. Have to turn music and sfx to make it work without lag but other than that, great game.",positive,0.9463176131248474
Stirling Hall,2/10/2022,This is a great game of life and unlike other games this game actually comes with a challenge and I haven't had 1 app pop up yet. Great game 10 out of 10!,positive,0.9812102913856506
Mikah Maiden,4/11/2023,This is supprr fun and has no adds to get in the way also it lets you pick if you want to be offline or online soparents dont have to be worried about that. FUNNEST GAME EVER!!!!!!!!!!!!,positive,0.9064810276031494
Jaicee Meier,5/11/2022,"It keeps on glitching up. It's to the point where I can't even hardly play it. I can't even play it for more then 3 min. And I have to turn it off I even paid for all of the worlds so I spent a lot of my money just to play a stupid game that I can't even play now because of the glitching. What am I supposed to do? I hope I can at least get my money back, if I'm unable to play it.",negative,0.9444882869720459
Chris Bender,11/1/2021,The game favors the computer so highly It makes it not fun I can only spin 1-4 unless it's my oppents lucky number then at the end since I'm only at Carrer and there retired theye win everything never buying from marmalade again its sad it's more important that the computer has the advantage then letting the game play out naturally,negative,0.8395365476608276
Magic 10 Slots,7/15/2020,When I got to the end the game would not work fully connected to internet I switched to 4g it worked for 2 second then could not do anything so had to close game so know idear if I won also there is no way to see past games,negative,0.8510702252388
Garrett Ratt,10/22/2021,"Paid 7.50 for the game, wanted to get a different map so paid another 7.50 for the spooky pack and its literally the same map just reskinned. The game is all chance there no skill involved what so ever.",negative,0.6169055104255676
Randal Alford,1/14/2021,"Fun game but goes thru bouts of NO INTERNET CONNECTION when I try to play multi-player mode, yet I'm connected to the internet. Rather frustrating.",negative,0.8369382619857788
Janette Lindsey,9/17/2020,Far from the classic Was super excited to play however there is so much change we didnt get to buy a home or have a good chance for a family Hopefully you fix it??,negative,0.5615819096565247
Emma Hood,10/9/2021,Enjoy playing this game but seeing as we pay for this game why ask for us to pay more to play different worlds. Abit cheeky to be honest. Why can't we unlock worlds/outfits by completing collections.,negative,0.43026047945022583
Tyson Walz,4/6/2023,34 years old loved the game of life since I was very young. The game was well worth the price and run great and has amazing replayability,positive,0.9875642657279968
Ashlee Hanford,8/12/2021,"MEH....$4 for a game with no advancement or rewards except an extra outfit or so, was fun til it got boring unless you're willing to pay $4 for a different board everytime",negative,0.7351445555686951
Poppy B,4/17/2023,its good mostly BUT the board is a lot shorter and a whole bunch of stuff is paid (theres a whole vip package you can pay for) i think i prefer the first game.,positive,0.9457684755325317
Kristian Townsend,12/6/2020,"Super fun!! I was playing my first competitive game and won by a few points, overall performance is very good so far but would like a bigger map",positive,0.9895467162132263
Alexis Edwards,12/2/2021,"This is terrible, the only way to unlock other boards is to pay $4.99... once you collect everything you have no point to play on...",negative,0.9433505535125732
Amanda Utley,3/15/2021,The whole family loves it. We have 2 different board games of LIFE & I just Absolutely in love with this one I downloaded on my phone. My husband even dowloaded it!!,positive,0.9885104298591614
Heather Nelson,4/11/2022,This game is just ok. I would play this game more if you added points for the babies. It is addicting until you run out of puzzle pieces.,positive,0.961898684501648
Kenny,8/3/2020,"The game is okay. Everytime I try to play with friends it kicks me out mid-game. Kinda annoying, rather just play the board game",negative,0.6819294691085815
Scaramouche,7/15/2020,Amazing game but it's too short and predictable. Can't play this alone in a long run. Sometimes laggy but that's okay.,positive,0.4060780704021454
Jalisa Gunner,10/11/2023,The competitiveness doesn't get too bad and overall it's a wonderful game in the lads no nothing just peaceful gaming for my kid's.,positive,0.9631980061531067
Gunnardab,8/7/2020,I like this game somewhat however the fantasy was a let down. There were no fantasy pets still just dog and cat what about a dragon or elf or werewolf. Even the actions are the same . how about getting turned into something instead of taxes.,negative,0.793537437915802
HI HI,7/5/2022,"Not what I expected, the game is too short and the game glitches often making me have to close the app and restart my game.",negative,0.9170132279396057
Juniper Whiskeytart,1/27/2022,Your game sucks it constantly tells and shows me I'm bad and it feels like the computer rigs the roulette you call it random I call it rigged it's a waste of time and money.,negative,0.9599214792251587
Anya Carpenter,2/3/2023,Ypu only ot one map and have to pay for rest whem I already had to buy the game. If you have to buy the games then you should get everything with it.,neutral,0.6375245451927185
Dale Chambliss,3/14/2023,It's nothing like the actual board game and too me it kinda of sucks actually especially at over 500 mb for a game that isn't fun at all kinda of confusing I rather it be the board game like back in 1990's or 1980's board game was more fun than what u have here,negative,0.8909884095191956
Johann Murillo,6/6/2021,Its a fun game with different things to do but im giving this 4 stars since it can get very boring at times but it is a great game and suggest you should get it.,positive,0.9517389535903931
Rebecca Wilmot,5/13/2021,Only giving you 2 stars because I've played single player and online multi-player and have never won a single game...also the game cheats on mini games within the main game...I'm so disappointed that I actually paid for this app and can't win even one game!,negative,0.9427880048751831
Charlene Delgado,8/30/2023,It's awesome you can play with family members from different houses 😀,positive,0.9813854694366455
Sae Sae,2/1/2021,"The games not bad, but REALLY not worth the price. This game should be free with the amount of game play you get out of it. You could add so much to this game.",negative,0.5015625953674316
Vikalp Dubey,8/12/2023,"Too slow,Should have a fast-forward button",negative,0.8310494422912598
Jasmine Johnson,11/28/2020,It's been a really fun game but I went in to debt one round and it tells you to pay before the end of the game but it never gives you the option to,positive,0.3733530044555664
Samwise Gamgee,7/30/2020,I really enjoy playing this game in Pass & Play mode with my family. But could you add ability to change human player names in Pass & Play mode?,positive,0.9396348595619202
EmpPhantom,4/19/2022,Absolutely love the game! Only thing I wish is that there were different difficulties for single-player to make it more interesting,positive,0.9760993123054504
Thomas Lockett,7/25/2020,"Too short, having a family in the game doesn't really give you any advantage and everyone you play with should be able to contribute to the achievements.",neutral,0.6185324788093567
Vada Streeper,7/14/2022,One would expect that a game that you pay for would be fully unlocked and not have to pay to unlock different themed boards.,neutral,0.7943249344825745
Cai Png seller,11/25/2020,I should have known I would had only have one map and buy the others this is a joke! Why must I pay for the other maps as well and the other maps are all over price,negative,0.8331177830696106
Sinner Klotz,7/5/2022,Loved the game as a kid and this take on a classic board game is fun and entertaining and a nice way to pass the time great job to the developers keep up the good work 🙂,positive,0.9878036975860596
Glenn Coogan,4/18/2021,Not happy. Paid £3.99 for the game and £5.99 for the fantasy bundle to then play it and see that all of the actions in the fantasy world are the same as the normal game. Not impressed.,negative,0.8886094093322754
Stephen Mann,1/1/2021,Great game however when buying the extra maps it does not give you a new experience and no new challenges which means it might get a bit boring,negative,0.6704296469688416
Rachelle Harmon Harmon,2/22/2021,I enjoy it but the upgrades are so expensive it's discouraging. Sometimes I wish yall had loyalty points in games.,negative,0.7570377588272095
M Childers,8/23/2021,App isn't straight forward. Greedy to the max.... You get 1 world and pay $4.99 for different worlds without different features!! If you refuse their privacy policy then more features won't work.... The world is sick w greed,negative,0.921489953994751
