Name,Date,Text,Label,Score
Zoe Luce,9/28/2023,this is a really fun game with lots of potential.. but like.. you get one map and if you want other maps they're $5 a piece after already paying $3.99 for the game.. so as soon as you unlock your collectables on your one and only map it gets boring and you don't want to play anymore. Maps should be unlockable.. imo was super fun to play though reminds me of the old PlayStation game of life back in the day. Use to be my favorite.,positive,0.6803325414657593
Adam Taylor,6/20/2021,"You get 1 map, then have to pay for each map after. Spinner is not actually random. I've tested this, and the spinner will only give you certain numbers, based on your choice at the stops. The computer characters make terrible choices, yet are very ""lucky"" when it comes to landing on the spot they need. You usually win the game, but this game is full of errors. You also spend more time waiting for the other characters to finish, than anything else. This could be a great game,",negative,0.4618437886238098
Julianne,8/7/2020,"The game is fun but short. Especially since the spin function doesn't work well. The amount of times I spin and get a 7, 8, 9, or 10 doesn't seem statistically fair. I feel like I am always going to spin high, thus landing on barely anything good or bad. I wish there was an option for a longer board. At very least, an improvement to randomozation of the spin or use dice instead.",negative,0.8019011616706848
Bethany Ng Tang,8/25/2021,"Was really excited to download this game. What you get for $4 is 1 board, the standard outfits and cars, and if you complete 6 ""missions"" you can unlock some really disappointing outfits and 2 cars that look alike. If you want the FULL game, it's $34.99+tax. Outfits start at $.99 and can go up to $3.99, with new boards for $5 a piece. Extremely let down for a game I paid for.",positive,0.5890041589736938
Kate Hoyt,8/4/2020,"The map is too short. In most of my playthroughs none of the players get a house, let alone buy and sell more than one. Seems like a waste of an idea since it's so rare to land on a house space. There are also many playthroughs without any pets or kids. The map is just too short to experience the content. Also each game has 4 players but there are only 3 different icons to choose. Other than that, it is fun!",negative,0.7936925292015076
LG Hakubi,7/18/2021,"It's okay. I like the updates but the old board game feels more full and dynamic. The spinner needs adjustments because it's way too easy to blast to the end of the game without getting any options. Like I always blow by the family and investment tiles when going down those routes yet somehow I always land on taxes. The game only runs long because you have to wait for everyone, the board isn't large at all. Fast forward should just stay on. DLC costs are incredibly high and not worth it.",neutral,0.4402449131011963
B. P.,1/28/2021,"It's a decent game, but the turns can take too long for online play. Also, there are definitely glitches and bugs that need to be addressed. The game freezes constantly, to the point where you have to close the app in the middle of a game and lose that game. I have a Note20 Ultra, and this game constantly freezes..",negative,0.8826546669006348
Cierra Berrie,9/2/2020,I really enjoy this game! But with the update I lost all of my collectibles... Also seeing a longer game option would be wonderful! I enjoy the shorter board too but having that variety would be a lot of fun. More house spots and more job spots. Even so more risk. Maybe adding in a lose your job space(s) just to make things a little more interesting.,positive,0.9448887705802917
J Barefoot,2/12/2021,It's ok. I didn't mind paying to download. I just hate that you have to pay more to unlock new boards. I pretty much got most of the achievements filled for the free/first/only board you can play. I found myself bored of the same board. I think each board to unlock costs 3.99 or 4.99 (US). Then if you want to unlock other vehicles or outfits etc it too cost 99-3.99. It's ok overall. Going to uninstall though since I got bored of it.,negative,0.6469863653182983
Chyanne DeLong,12/14/2020,Pay to play game 💰💰💰 If you have alot of money then you can really enjoy the app. Cause when I bought it I thought I would have gotten all of it but I was wrong. It includes season passes you can choose to pay. But the game gets boring once you finish the original one. Honestly it feels like the computer is not going getting to pay taxes or and is always getting high numbers and is always going first. It also seems that the computer ends up but gets money 💰 from me but not the taxes.,positive,0.8138478398323059
Rosemary Hernandez,10/24/2020,"If I would have known we only get to play 1 map and have to pay for the others, I would have never purchased this. It's a fun game, but i thought more maps would be become available over time for free or you have to gain puzzle pieces to get it. Something like that. I don't recommend if you only want to play 1 map or don't mind paying more for each map.",negative,0.6806058287620544
Karla Grubb,1/17/2021,"It's a fun game. It reminds me of the original board game. You can also play with friends in person by passing the phone, or with online players. In single player mode, you can raise the speed of the bots to 5X. Shortcomings are that even though I paid for the game, I still have to pay more money for any bells & whistles. And, the game does not have the stock, or fire & auto insurance. Cute game!",positive,0.9318408966064453
Missy Menawonu,7/30/2020,"I liked the first one better, this one is lacking. I have to sit and watch an ad to skip all the CPUs turns when I just spent $3.99 plus tax. Yeah I do not think so. I got my refund and I will not be putting it on my device again. I wish the first game was still being worked on, this is a huge letdown when I was expecting to be blown away. I'd take the crashes and glitches from the first game over this lackluster excuse for a follow up. Talking about fast forwarding through their turns.",negative,0.8528077006340027
Misty Roop,5/1/2022,"The only way to win the game is to choose to stay single and take the investment route. If you get married and go the family route, you lose every time. I also felt that it could last longer. The board seems much shorter, and there is not very much variety between the life cards or job cards. They are very repetitive. Too many things have been changed in not so good ways in my opinion. It's a poor sequel to a great classic game.",negative,0.6742482781410217
Hannah Turner,11/25/2023,The game is awesome now the only thing I don't like is you have to pay $4.99 for other levels but the game is cool either way I love it and it was totally worth paying for. ☺ lol at least I don't have to hear my brother yell every time someone takes his money 😂 😂 😂 I play with computers,positive,0.8710113167762756
Xander Dascomb,10/3/2023,"I feel like the single player is lop side. Most of the time I roll low numbers, and lose the competitive rolls. Also I'm rarely ever chosen to go first it's always the 2nd bot which causes me to be 3rd, but besides all that it's still entertaining to play.",negative,0.6828452348709106
Angela Calhoon,10/20/2023,This game is extremely boring. I only play it because I spent money buying it. I really regret buying it. The cost to add avatar options is ridiculous. I really would like my money back.,negative,0.9578624963760376
Queen Bee,9/28/2023,"Love this game, i have bought many worlds and play all the time with my friends on the pass and play option. My only wish is to have a different layout of the track in a couple of worlds. Its fun playing but it does get boring after a bit with the same road.",positive,0.9545361995697021
Martin Boyer (Evil),8/28/2023,"Ever since I was young and had my very first computer, I had played the board game, and the computer game. This game is very fun. I like the new boards and cosmetics. I love going for all the collectables one one board before moving on to the next. I've actually played this game for about 4 hours straight one night lol. Anyways, definitely recommend. Bravo Devs, Bravo!",positive,0.982585072517395
katelyn kramer,6/27/2023,"While there is a better variety of careers, and peg colors, I always end up rolling high and I don't get things like houses or kids. Not very fun when you don't get to experience everything, I've played several games and they always end the same. Also you get the same tile options in every pack, not a lot of variety.",negative,0.8056044578552246
Jeffrey Kosse,10/13/2023,Will update Life 2 in a sec after a quick patch in for glitches so I don't need to rebuy content again. I played all the themes for this game.,neutral,0.559658944606781
Tristan Williams,8/30/2023,"Do yourself a favour and play this game offline. It's a joke playing this on the phone. Rolls are not random. And playing it online, people manipulate it far too easily because the speed required to justify a roll is far too low to actually be helpful. For me in multiple games to land on mostly tax spaces and then be beaten at the end by someone manipulating bucket list rolls every turn is a joke. This game is more frustrating than fun.",negative,0.87734454870224
Jessica Rybka,7/26/2023,"Definitely worth the money, I love playing the pass and play mode with my family everyday. It's really fun and very realistic with taxes. 😅 I one hundred percent recommend buying it. Plus it's only five dollars here in Cad! (5 Star review)",positive,0.9864901304244995
Kelly Wood,8/27/2023,"Give me the original any day over this, it's so slow gettin a turn, where as the original it's literally seconds, there's no mini games either unlike the original, and not even anywhere near as long as the original either, not worth 3.99",negative,0.913748025894165
Scott Barton,7/29/2022,"Ok Game, but too slow and anything extra is paywalled within the game. You get a few small collectibles but if you want to change the board or anything to do with the game its extra. I paid for the game, I'd like everything in it. The cut scenes in the pass and play mode are too slow, the game has 1 clear winning path every time you play, college>invest>house>safe(anything else loses). There isn't enough variety to keep the game interesting, it gets boring after just a few play-throughs.",negative,0.7516198754310608
JODIE Moore,9/29/2023,Question. Didn't know how to contact you any other way. Does the big bundle have Everything in it. I'm asking because I bought everything separately before the bundle popped up. I want to purchase all the things for my sissy. So if you could respond I would be greatful. Thank you.,neutral,0.6221478581428528
Sammy Rivera,9/21/2023,"It's a very fun game very much like the game of life, you can also play online multiplayer which is amazing, and there's pass and play so you can play it without buying the board game!",positive,0.9866744875907898
Hunter Collins,9/11/2023,"It sucks donkey sausage! It's short, it have very few careers, and no options to change the game play style. Very disappointed. Shame on Hasbro",negative,0.9576933979988098
Dr Chocolate,7/25/2020,"Honestly not a bad game, I think they made some improvements that is a step in the right path. The only thing that is holding me back from giving 5 stars is that I wish the skip button isn't just 5 times speed and normal speed, 5 times is too fast to see anything, but normal is too slow and boring. Other than that, is game is awsome and I would recommend it.",positive,0.5474157929420471
Shandel Langager,2/8/2021,"Great game! Reminiscent of the old classic board game with some fun little twists! Has kept me entertained for countless hours! Looking forward to more worlds and updates! Would be nice to have the option to skip through the animations to keep the game moving on in single player mode or be able to choose a longer or shorter ""trip"" with a bigger game board option and extra vehicles/costumes rewards for completing the larger board. I'm excited to see how this game progresses!",positive,0.9852161407470703
Rob Cowden,10/28/2020,"Much better development, with it going along the old classic game. Like the path scenarios, but just as I was getting into it, it ended. Feel it should have been a longer running path. If you took the board length of the first version with the play format of the new version, you'll be definitely getting there. Update: After a few plays, have a couple of thoughts. Having children only gives you hearts, why no cash bonus at the retirement? The game ends should end on the round not a person.",positive,0.8117420673370361
Lucy,7/25/2023,Even though the game cost money there are still micro transactions in order to play different maps since you're only given 1 free map. Fun game but pretty expensive for a game that's supposed to be fun,neutral,0.4534812271595001
raindrops 33,7/12/2023,"Its a really fun game for a good price - Nostalgic, well made, and lots of ways to play. My only issue is that you get one world, all others are locked. Why not two?",positive,0.8440349698066711
Kaboa Yang,6/29/2023,"Super fun game. Down fall you gotta buy each world but it's not too bad. It's fun seeing what the other worlds have for clothes, vehicles, jobs etc.",positive,0.9376730918884277
Gabriela Leon,8/14/2023,"I think it is really good and fun but some details have been left out of the original game, like the family points dont count, and it feels shorter",positive,0.5489870309829712
Kailey Kirkwood,6/12/2023,Fun game just wish the other boards were cheaper than 4.99 I feel like they should be more like 1.99 than more people would probably buy them other than that alot of fun I love how they have an online option,positive,0.9213358163833618
Branson Pappageorge,11/17/2023,"Could be a little longer but it's fun, especially with friends.",positive,0.9665558934211731
Monkey Mallow (Monkimallow),1/24/2021,I own the first one on the computer as well and while I really enjoy the unlockables aspect and some of the other mechanics... we no longer get money for action cards collected or children. And of course the two mini-games are no where to be seen in this version of the game. I really enjoy the van mini-game and the 10 meter run one from the first one and think they would fit here too over just doing spins for the highest number. (It gets a bit boring after a while.),neutral,0.43990904092788696
Caleb Whiting,1/20/2021,"Great game with solid replayability, but caught me off guard with misleading in app purchases. I bought one of the ""new worlds"" to play with my girlfriend only to discover that it only changes the cosmetic appearance without altering the original board in any way. Advertised as ""new worlds, visuals and cosmetics"", you would expect an entire new board rather than a skin. I would typically request a refund, however, the game is still enjoyable and I wish the developers all the best.",negative,0.59113609790802
Leah Gibbons,5/17/2023,"This game is very fun. I wish we could change the names of the players in Pass and Play, that we could oust players who are taking a really long time to make moves in Online Multiplayer, and that we could view the different houses/jobs, etc. that we've gotten throughout the game. Also, the family choices are glitchy; I've chosen dog and gotten a cat, I've chosen a girl baby and gotten a boy. It's not cool that you have to pay $4.99 each to unlock other boards when the game already costs $.",positive,0.6793302893638611
Kaylin F,1/10/2021,Game is okay but for the price I wouldn't really say worth it. Its very short and I have had it freeze on me 3 or 4 times. When it freezes you miss out on some in game stuff and it just jumps to your turn so you don't really know what happened. It has a bunch of potential but I wouldn't say its worth the money at this point. Make the board longer or at least give the option for a longer board and work out the little kinks and it would definitely be a great game,negative,0.7220203876495361
Jasmine Quintanilla,10/14/2020,"Fun, classic Life experience. I do like the fairy tale add on as well. Online can be frustrating when opponents aren't taking turns. There isn't a timeout or anything so you just wait forever. I gave it 3 stars because of this, and because I paid for the World bundle months ago and am still waiting. I'm wondering when another world (or world's) will be out.",positive,0.8088875412940979
MacKenzie Tumak,5/5/2023,"Board is short, repetitive, and overall it's boring. I loved the computer disc version of this game once upon a time, but this seems so short and low effort. There are a ton of extra things you have to pay for, and they want $60 for the whole bundle. This wasn't even worth the $6, definitely wouldn't waste any more money.",negative,0.9300146102905273
Bekka Babcock,7/20/2020,Price was decent. I like the puzzle pieces but I see the same cards and jobs over and over so that tells me there isn't a lot of different choices or options with action cards or jobs. I like you can speed up other players turns when playing solo and I like the fairytale land but the price for that was ridiculous. Hopefully they make this game a lot more different than the 1st.,positive,0.6707150936126709
Tim Richard,7/1/2023,Downloaded with some play credit and very pleased with the game! Just like the board game and it's easy and simple!,positive,0.9872906804084778
May Luurt,7/1/2023,"I love this game, there may not be many options and types of jobs and choices but it can still be a blast. Nothing else to say...",positive,0.9707152843475342
Erik Hunt (whiskyjacked),6/23/2021,"Kinda fun, but you have to buy more maps...after buying the game!! What a joke! I can understand having to unlock more maps/boards but not having to BUY them all. And the game is pretty fun, but $35 on sale is what it costs on top of the game purchase to unlock the other boards. Shameful. Update!: It also loves to randomly freeze up completely!",negative,0.8590759634971619
Zoe Clarke,10/19/2022,"The family and I absolutely love this game, it's great for all ages. Loads of fun. But....I am having issues with purchasing additional boards. I already own the age of giants board, and when I go to purchase anything, it's unable to connect to the store, which is extremely disappointing as I would love to get the VIP pass. Any information as to why I am unable to make additional purchases would be greatly appreciated. Thanks for bringing a great old game to life. I agree longer games options.",positive,0.857711911201477
Vero Rodriguez,7/21/2020,Fun! It's very fun to play and it is so awesome. You put a lot of effort into this and I love it. Though there is a problem. I'm multiplayer some people never ready up. Can you make it so they have atleast 1:30 to ready up before getting kicked or something? I also found a bug there. When you try to press the ready button sometimes it wont work. There are some problems but other than that I would recommend buying this game.,positive,0.9147340655326843
Azure “TheStainsOfTime” Wolf,8/28/2023,All I gotta say for some dlc maps may be 50%off but come on life the game of life I could just play the actual boardgmar where I get consualy messed up you got the all the taxes. In real life come on.,negative,0.5501863956451416
C J,5/31/2022,"Online feature doesn't work. It says there's a connection issue but my Internet is working fine. Apparently there's not many players who use it anyway, however that might be too do with the connection issues. The game is also very quick, and there is not a big variety of cards. The same cards come up each game so I think this will get boring quite quickly, particularly going against a computer all the time. It's a game that has promise, but needs work.",negative,0.7428673505783081
Shana King,3/14/2022,Fun but the game keeps freezing and I have to hit save and quit to get it to unfreeze. Once it froze right at the end though when it was determining the winner and I had to force course and that game progress was lost. Now I'm having it so that it will randomly shut down completely and close the game on me. I was hoping to not have any issues but I'm not willing to buy the expansions as is right now.,negative,0.8878269195556641
Van Kirwin,1/17/2021,"Don't suppose they'll give a refund, so don't bother with this one. You get to make a few choices: (college/career), (get married/stay single), (safe path/risky path). But sadly the way you receive attributes is just by random chance, especially after you retire. You also have to hope you land on an orange spot to buy a home, and the lucky numbers add nothing to the game. Same experience every time... Waste of money, especially for the other maps which are $4.99 each.",negative,0.6817104816436768
AKHIL GOYAL,4/17/2023,"This game is fun when you play for the first time but as you play again and again it gets really boring. It is a 4 player board game but you have to wait for a looooooong time before your turn and it really sucks. This game is just so easy I can say even a 5 yr old child can win every single time if he knows what to do. There are just too less variables in this game, it makes winning too easy. Its like you just have to choose same path again and again. I just feel like waste of money.",negative,0.8064712285995483
Ryan Garvin,12/17/2021,"It's definitely not the best version of life but it's the best you can get on your phone. They really need to add an option to limit the rolls from 1-5, 1-6 or something less than 10. The board is so short and the games go so fast. There's never a chance to do anything. Being able to buy a house is so so rare because you are constantly skipping over all the opportunities. Same goes for most other things, you're lucky if you get to do anything interesting in the game.",negative,0.7435104250907898
Sumon Khan,7/28/2020,"This game is good, but whenever someone is not taking their turn it keeps loading, there should be a time limit for taking turn or choosing the choices! Edit: Ty, now there is timer! And one more thing, it will be great if there is a league system based on points or what you think better! It will attract people more to play! Or this game will be boring after playing week!",positive,0.6783801317214966
Kyrsten Langley,11/29/2020,"Good game and a excellent time killer. My only complaint is the game needs to be longer between each achievement. Aka Collage, Marriage, Retirement ect. It would make the game easier to get into and not feel like such a rush. I gave 3 because the game feels incomplete, more like a demo.",positive,0.6721712350845337
Brittany Michael,7/15/2020,Alright. Could be improved by fixing the big where you must press FF5x every time anything changes in the change (very annoying). Also in online multiplayer there should be a timeout when a player stops playing and the computer takes over for them. Otherwise you get trapped in limbo.,negative,0.6988669633865356
Victoria Smith,4/28/2021,"I'm a huge fan of the original board game and this feels like a step back. I love the new options like having a pet rather than a child but the changes in gameplay are disappointing. I played 3 games and never once got a house, that's disappointing. The life tiles are really low stakes now. Everyone is having guitar lessons or upgrading their computers rather than vacations or sending kids to summer camp. Also the game is way shorter now and the outfits feel like a money grab.",negative,0.7513769268989563
Lee B,8/3/2020,"I have always love the game of life, and I love the updated and goal oriented gameplay of this one. I love the male, female, nonbinary choice for pieces. The reason I am doing 4 stars is becsuse of Fairytale Kingdom. My expectations were it would be a full fantasy map with everything altered to be fantasy/medieval-- considered the price. I was disappointed to find it was essentially just a fairytale skin. The house and jobs changed but everything else stayed modern. Poor purchasing choice.",positive,0.9359220862388611
Anna Hapiuk,7/2/2021,"Disappointed in this game. I was hoping it would be more like the modernised version where you can come back to options like getting married and having kids but you can't- once you make the choice, that's it for your ""life"", you can't come back to it later. Cost of things in the game like surfing lessons are ridiculous, not to mention the cost of the game itself. Paid $6 for it and its only the basic version. I'd have to pay another $60 odd for the full version. Uninstall after 1 play.",negative,0.8333308100700378
Steven Carter,9/17/2021,"It's Different from the Board game but does evoke some of the old charm.There could be more spaces to travel,and they could show the Details of the Upcoming Spaces,but, I really do enjoy the way it plays. It's silky smooth,nice cute cartoon ish quality that I imagine kids would like.The wheel can be a bit easy to manipulate,though just when you think you've mastered the high number spin,it reverts To lower numbers.It let's you play online,or head to head,or against the Computer.I recommend it!!",positive,0.9141278266906738
Ash K (Shortgrace),1/9/2022,Great overall game. Pretty similar to the board game but for the price I expected more. For $4 you only get 3 outfits and the standard board game. For another $35 you can unlock the rest. So ur paying $40 for customizations that is jus simply that. Customizations.... the boards aren't even that different. A bit of a let down for a classic game fanatic,positive,0.6935756802558899
Bill Carlson,10/14/2022,The game is more generic than I expected. A little more interaction with the animations would be nice. As well as the choice to play two or three friends. Also navigating through the outfits and puzzle pieces are a little bit confusing.,negative,0.7957546710968018
